source_text,target_text
"this professor is giving off fool, clown, idiot energy honestly",bro this professor is giving full bozo energy
"never mind, it is showing on god, i swear energy again",nvm its giving ong again
let's hang out after school tomorrow.,"yo, let's vibe together after school tmrw!"
"oh my goodness this professor is giving off excellent, amazing energy honestly",ok very bro this professor is giving full fire energy
i'm just really tired today and just want to relax at home.,"i'm super drained today, just tryna chill at home."
"hey, i just got back from school and i'm really tired.","yo, just hit home from school and i'm totally drained, fr."
i'm just going to chill at home and watch some movies today.,i'm just gonna vibe at home and binge some flicks today.
not me acting all extremely suspicious at the worst time.,not me acting all sus at the worstt time.
truly groundbreaking the way this demonstrates staying up all night studying and that is funny,groundbreaking the way this is all-nighter no cap
i just got back from shopping and i'm really tired.,"just hit the mall and i'm completely drained, fr."
very much college finances lead to very leave the internet and live life eating choices,sis college budget be like: go outside eatingg habits
my academic performance after this term will be right now,my gpa after this semester gonna be rn
the course outline is displaying to be fair very early on,the syllabus is giving tbf real quick
solo queue feels like a team of sarcastically praising an obvious thing players,solo q be like: full team of wow very brave players
"i'm feeling pretty tired today, so i think i'll just stay home and relax.","i'm lowkey drained today, so i’m just chillin' at home to vibe."
"the cafeteria served something someone seeking fame or attention today, no exaggeration right now",the cafeteria was clout chaser lately no cap periodt
i am about to leave.,i'm finna head out.
the professor held office hours and they were actually be right back,office hours today were actually brb
the boldness of this sarcastically agreeing energy is remarkable truly,the audacity of this oh totally behavior ong
live footage of me embodying to be fair,live footage of me being tbf
not me acting all show off at the worst time honestly,not me acting all super flex at the worst time bestie
i care about you but that opinion showed i'm going to fail this exam,ily but that take was i'm cooked for this exam
that person has a deeply emotional internet aesthetic energy today honestly,that person has corecore today fr
"i won't lie, that genuinely showed close friends, family-like people without question",i'm not even gonna lie that was fam istg
"he keeps telling me i am overreacting, but i think he is manipulating me psychologically.","he keeps telling me i'm overreacting, but i think he's gaslighting me."
stayed up all night and now i am experiencing for your information,pulled an all-nighter and now i am fyi
"hey, did you see that new movie everyone is talking about?","yo, did you catch that new flick everyone’s vibing over?"
i'm just really tired after a long day at work.,i'm totally drained after a long day at the grind.
did you catch how in trouble or did well that was?,did you catch how cooked that was?
everyone his reaction was very confident and unapologetic i could not stop laughing.,omg his reaction was very based i could not stop laughing.
seriously speaking he was being totally delusional arc at the party.,ngl he was being totally delusional arc at the party.
"wait, was that not completely extremely good?","wait, was that not completely bussin?"
"okay i'll admit that was somewhat in a focused, productive flow state though friend",ok fine that was kinda in my bag tho fr
"the opposing team is demonstrating charisma, charm, ability to attract as usual",the enemy team is playing rizz as usual
find the difference between i don't know and normal behavior,corporate needs you to find the difference between idk and normal
unexpected reveal: it was sarcastically praising something bad the entire time i promise,plot twist: it was iconic genuinely all along ong
completely unhinged display of slightly below average if i am honest i swear,absolutely unhinged lowkey mid behavior genuinely lmao
how do you wake up and choose to be perfect atmosphere or energy,how do you simply wake up and choose immaculate vibes
"not all remarkable people wear capes, some simply embody broken, not working i promise",not all heroes wear capes some are simply bricked fr
"honestly yes please continue, this dismissing outdated or traditional thinking is very incredibly helpful",bruh yes continue please this ok boomer is very helpful
he is behaving in an extremely best friend way today,he's being so bestie today it's unreal
that comeback was very extremely looking extremely good or slim honestly.,that comeback was very snatched af honestly.
"seriously speaking my study group is helping me, which shows real in my humble opinion",omg my study group is carrying me that's very imho
live footage of me embodying doing something excellently friend,live footage of me being slay ngl
"hey, are you busy this weekend?","yo, you free this weekend or what?"
"the professor held office hours and they were actually good game, well played",office hours lately were actually gg wp
"everything is fine but actually it is shaking my head, disappointing","this is fine (it's not, it's smh)"
that assistance was so coming back after failure i cannot process it,that carry was so respawn i can't even
i'm feeling really tired today because i stayed up late last night.,i'm dead tired today 'cause i pulled an all-nighter last night.
i'm just relaxing at home and watching a movie.,"i'm chillin' at home, vibing with a flick."
best friend that outfit is very extremely good.,istg that fit is very bussin.
he was being completely extremely dead at the party.,he was being completely dead at the party.
"why is everyone acting so go outside, spend less time online these days",why is everyone so touch grass lately
"yes please continue, this caught doing something with clear evidence is very incredibly helpful",yes continue please this caught in 4k is very helpful
unpopular opinion: people is somewhat experiencing expressing disbelief or frustration,hot take: people is lowkey bruh
not me acting all extremely charisma or flirting skill at the worst time.,not me acting all rizz af at the worst time.
"friend i find myself being very relax, calm down about all this",real talk not me being chill about this
i just finished my homework and i’m feeling pretty good about it.,i just bossed my homework and i’m vibing with it.
he buys her gifts every day; he is excessively devoted to her.,"he buys her gifts every day, he's such a simp."
"i do not know why i am so good game, well done right now",idk why im being so gg atm
"hey, i'm feeling a bit tired today.","yo, i'm kinda vibing low today."
that assistance was so extremely funny i cannot process it,that carry was so lmaoooo i can't even
"the dormitory internet connection is absolutely oh my god, i'm shocked seriously",bro the dorm wifi is absolutely omg lmao
surely this will end well given all the having teammates win it for you involved,surely this will go well being so carried and all
i genuinely cannot believe how quickly this became i swear to god truly,genuinely cannot believe how istg this got very fast ong
"hey, do you want to grab some food after school?","yo, wanna hit up some grub after class?"
oh my goodness that was very staying up all night studying i swear,omg that was very all-nighter istg
"chronic in a focused, productive flow state hours, who can relate",chronic in my bag hours who else
"hey wait, is that not considered one of my followers?",fr tho wait is that not oomfie?
"seriously speaking okay talk later, this is too causing sudden disgust to process",lowkey ok ttyl this is too giving me the ick to handle
"hey, i just got back from the grocery store and i'm exhausted.","yo, i just hit the grocery run and i'm completely drained!"
"hey, can you help me with my homework?","yo, can you peep my homework real quick?"
"for real though how it began was fine but now it has become exciting, amazing, awesome",ngl how it started: fine. how its going: lit
"seriously speaking okay talk later, this is too mediocre, average, not impressive to process",y'all ok ttyl this is too mid to handle
i was just chilling with my friends at the park.,i was just vibin' with my crew at the park.
"how very performed perfectly, nailed it of you, truly well done right now",wow so ate of you really well done lmao
"solo queue feels like a team of win, success, great outcome players",solo q be like: full team of w players
i'm really excited to hang out with my friends tomorrow.,i'm super hyped to chill with my squad tomorrow.
"what riveting content, the level of that's very awkward or bad is impressive truly",riveting content truly the big yikes is impressive istg
i can't believe how tired i am after a long day at work.,"bruh, i'm mad wiped after a whole day grind."
"oh my goodness the cafeteria served something mind absorbed in internet content today, no exaggeration",real talk the cafeteria was brainrot lately no cap
"yes, the classic controversial opinion move we all anticipated",ah yes the classic hot take move we all expected
unpopular opinion: people is somewhat experiencing dismissively patronizing,hot take: people is lowkey ok hun
i'm really excited about the new game coming out tomorrow.,"bro, i’m hyped for the new game dropping tomorrow!"
i'm really tired today and just want to relax.,"i'm so drained today, just tryna chill and vibe."
surely this will end well given all the did exactly what was needed involved,surely this will go well beingg very understood the assignment and all
the developers strengthened the daydreaming or mentally transporting yourself aspect again without question,the devs really buffed the shifting again periodt
i have never witnessed anything more one-sided emotional connection to a celebrity in my entire life friend,never seen anything more parasocial in my entire life on god
"hey, i just finished my homework and i'm super tired.","yo, i just knocked out my homework and i'm dead tired rn."
"for real though the cafeteria served something to manage disappointment unrealistically today, no exaggeration",dude the cafeteria was cope lately no cap
friend everything about this moment is extremely going through an unrealistic phase.,bruh everything about this moment is delusional arc.
"hey, do you want to hang out later?","yo, you tryna chill later?"
"come on now not all remarkable people wear capes, some simply embody this syllabus is very demanding",dude not all heroes wear capes some are just this syllabus is cooked
the universe when i attempt to show leave the internet and live life,the universe when i try to be go outside:
"this is your reminder that acting selfishly, prioritizing yourself is real not going to lie",this is your daily reminder that villain era exists periodt
okay so me having one productive day and my brain saying it is i'm laughing so hard time,bro me: has one productive day. my brain: it's i'm dead time
i find myself being very working very hard consistently about all this,not me being grinding about this
"this entire semester has been showing on god, i swear consistently",this semester has been giving ong the whole time
she is constantly seeking male approval by saying she is unlike other girls.,"she's such a pick me girl, always saying she's not like other girls."
friend that comeback was so extremely looking extremely good or slim honestly.,y'all that comeback was so snatched af honestly.
the way stylish campus outfits appeared suddenly for no apparent reason right now,the way the campus drip jumped out for no reason ong
that is giving a very specific thirsty feeling.,that is giving thirsty energy.
what the heck why is everything so i don't care today not going to lie,wth why is everything so idc today on god
"we are performing at the level of confident, unapologetic, admirable in this match",we are very based right now in this match
oh my goodness i am joking but also not joking because it is player who ruins others' experience,sis jk but also not jk because it's griefer
they were being so extremely she did it perfectly about this whole thing and that is funny,they were being so she cooked about this whole thing bestie
that person has confident and unapologetic energy today right now,that person has based today periodt
honestly right now i am fully in my overpowered phase,ngl rn im fully in my op phase
i'm really tired and just want to stay home today.,i'm deadass exhausted and just wanna chill at home today.
i'm just relaxing at home and watching some youtube.,"chillin' at my place, just vibing with some youtube drama."
we do not discuss sarcastically agreeing nearly enough,we don't talk enough about oh totally
i was defeated by that boss in a in my humble opinion way,i got imho by that last boss
seriously speaking they were being so extremely acceptable and understandable about this whole thing.,wait they weree being so valid af about this whole thing.
for your information people in this group is in my humble opinion,fyi people in this chat is imho
i'm just going to chill at home and watch some youtube videos.,i'm just gonna vibe at home and binge some youtube vids.
completely unhinged display of best friend if i am honest,absolutely unhinged bestie behavior honestly
best friend that outfit is so extremely good.,istg that fit is so bussin.
"the cafeteria served something overthinking to arrive at a weird conclusion today, no exaggeration",the cafeteria was galaxy brain lately no cap
i am feeling really extremely amazing or excellent right now.,i am feeling really fire af right now.
did you catch how extremely hot take that was? and that is funny,did you catch how hot take that was rn
that feeling when you finish a major project and can finally relax.,tfw you finish a big project and can finally relax
when the sarcastically noting something unoriginal feeling hits at three in the morning and you cannot sleep friend,when the oh wow so original hits at 3am and you can't sleep istg
"for real though if you understand fully focused and concentrated, you understand",not to be that person but if you know locked in you know
"hey, did you hear about the new music app that just came out?","yo, did y'all peep the new music app that dropped?"
seriously speaking the boldness of this emotionally provoked energy is remarkable,ngl the audacity of this triggered behavior
my academic performance after this term will be overpowered friend,my gpa after this semester gonna be op fr
"never mind, it is showing being thoroughly defeated energy again seriously",nvm it's giving getting bodied again on god
honestly that group project showed if you know you know and i completed it alone,fr tho that group project was iykyk and i did it alone
"the teaching assistant was in full that is true, absolutely correct mode today i swear",the ta was on full facts mode today bestie
that outfit is very show off without question,that fit is very flex istg
i am literally experiencing i know right right now,dude i'm literally ikr rn
your feelings are completely acceptable and understandable.,your feelings are completely valid.
friend that outfit is very w.,ngl that fit is very w.
"hey, do you want to grab coffee with me later?","yo, wanna tap in for coffee later?"
"hey, i need to finish my homework before i hang out with my friends.","yo, i gotta peep this homework fam before i vibe with my crew."
i'm just trying to get through the day without any problems.,i'm just tryna vibing through the day without any drama.
"can someone explain why this feels so excellent, amazing",tell me why this is so fire
"yes please continue, this for real for real, seriously is so incredibly helpful and that is funny",yes continue please this frfr is so helpful ong
college finances lead to very testing if someone matches the energy eating choices,college budget be like: vibe check eating habits
"five stars for the where are you, truly a special experience friend",five stars for the wya rating truly special fr
honestly i am simply relaxing in my very angry phase i promise,tbh i'm simply vibing in my big mad arc ong
"not going to lie, that was a difficult workout.","ngl, that was a tough workout."
"everyone was silent but me, displaying expressing disbelief or frustration",nobody: absolutely nobody:: me: bruh
the way she handled that was extremely a lie.,the way she handled that was cap.
honestly that stylish campus outfits was really surprising,bro that campus drip was actually wild
that disruptive player was operating in full sarcastically criticizing inaction mode,the griefer was on full great job doing nothing mode
that outfit is very out of pocket.,that fit is very out of pocket.
that comeback was so extremely intentionally building a mysterious presence honestly without question,that comeback was so aura farming honestly no cap
"wait, was that not completely extremely caught lacking?","wait, was that not completely caught lacking af?"
that meme is making me laugh a lot.,that meme is sending me!
this professor is giving off someone who tries too hard energy honestly,bro this professorr is giving full tryhard energy
"what a remarkable time to be alive experiencing openly, obviously, very much",what a time to be alive and experience highkeyy
i'm really excited about the new movie that just came out.,i'm so hyped for the new flick just dropped!
"attempting a stocks, but often used humorously for a bad decision challenge run tonight, wish me luck",doing a stonks challenge run tonight wish me luck
they were being very for real for real about this whole thing.,they were being very frfr about this whole thing.
i'm just going to relax at home and watch some movies tonight.,"i'm just tryna chill at home and stream some flicks tonight, you feel me?"
"society says act normally and i, being different, display i swear to god","society: be normal. me, built different: istg"
surely this will end well given all the sarcastically disbelieving someone involved friend,surely this will go well being so sure jan and all periodt
"in my opinion, that movie was not very good.","imo, that movie wasn't that great."
where are you? it feels like caught off guard or unprepared hours,bro wya it's giving caught lackin hours
"me attempting to explain extremely good, delicious to my parents or older relatives",me trying to explain bussin to my parents
i'm just chilling at home and watching some shows.,"i'm just vibin' at home, binge-watching some shows."
the gap between professionals and beginners is simply leave the internet and live life seriously,the difference between pross and noobs is just go outside ngl
me having one productive day and my brain saying it is where are you time,me: has one productive day. my brain: it's wya time
"hey, i'm just chilling at home and watching some videos.","yo, i'm just vibing at home and streaming some vids."
his reaction was so extremely amazing or excellent i could not stop laughing.,his reaction was so fire af i could not stop laughing.
that person has no energy today.,that person has nah today.
the gap between professionals and beginners is simply expressing disbelief or frustration,the difference between pros and noobs is just bruh
best friend i am literally experiencing serious right now,genuinely dude im literally srs rn
honestly right now i am fully in my intensely supporting a celebrity or artist phase i promise,ngl rn im fully in my stanning phase fr
"i'm really tired today, so i might just stay in and relax.","i'm so drained today, might just chill at home and vibe."
"we are performing at the level of weakened, made less powerful in this match and that is funny",we are very nerfed right now in this match istg
"we are performing at the level of confident, unapologetic, admirable in this match",we are so based right now in this match
"i am disappointed, the situation is so is excellent, hits hard",smh the situation is so slap
"the cafeteria served something a situation where someone is too online today, no exaggeration",the cafeteriaa was touch grass moment lately no cap
my best friend said it plainly and ended the conversation,bestie said villain era and left the chat
"five stars for the coming through in a critical moment, truly a special experience without question",five stars for the clutch rating truly special rn
i absolutely love how to be honest all of this is,oh absolutely love how tbh this all is
teacher says no wrong answers and i respond with having teammates win it for you,teacher: there are no wrong answers. me: carried
seriously speaking brain says sleep but also tells me to think about where are you,not to be that person but brain: sleep. also brain: think about wya
that car is severely damaged and falling apart.,"that car is clapped, it's falling apart."
"how very someone acting without personality of you, truly well done without question",wow so npc of you really well done istg
okay very surely this will end well given all the significant positive transformation involved,sis surely this will go well being very glow up and all
"that disruptive player was operating in full good game, well done mode friend",the griefer was on full gg mode fr
"is anyone else frustrated by that oh my god, i'm shocked decision friend",anyone else tilted by that omg move lmao
"i am disappointed, the situation is so in serious trouble friend",smh the situation is so cooked ong
quite openly i went into full losing intentionally mode and had no regrets.,ok so i went into full throwing mode and had no regrets.
i'm just finishing up my homework before going out with friends.,just wrapping up my homework before vibing with the squad.
i'm just tired today because i didn't get enough sleep.,i'm hella drained today 'cause i didn’t catch enough z’s.
i'm just really tired today because i didn't get enough sleep.,i'm mad tired today ’cause i didn’t catch enough z’s.
why is everyone acting so mind absorbed in internet content these days not going to lie,why is everyone so brainrot lately rn
that outfit is very charisma or flirting skill seriously,that fit is very rizz rn
i genuinely cannot believe how quickly this became that was an easy win,genuinely cannot believe how gg ez this got so fast
hey he went full extremely close friend group mode during the match.,bro he went full fam af mode during the match.
i'm really tired because i didn't sleep well last night.,"i'm so drained, i barely slept last night, fr fr."
"everything is fine, do not worry.","everything is gucci, don't worry."
"this lobby is different, it is displaying i know right",this lobby is built different it's giving ikr
"not to overthink this but solo queue feels like a team of win, success, great outcome players",sis solo q be like: full team of w players
why is everyone so extremely beta lately?,why is everyone so beta af lately?
"the boldness to display weakened, made less powerful so publicly",the audacity to be nerfed in public
i swear where are you? it feels like if you know you know hours,bestie bro wya it's giving iykyk hours
i'm just really tired after a long day.,i'm hella drained after a wild day.
is it simply me or is this giving extremely bitter or upset energy?,is it simply me or is this giving salty af energy?
"society says act normally and i, being different, display being delusional, unrealistic expectations friend","society: be normal. me, built different: delulu rn"
we do not discuss the problem is your own lack of skill nearly enough i promise,we don't talk enough about skill issue ngl
genuinely she literally said it with one-sided emotional connection to a celebrity and left,fr tho she literally said parasocial and walked away
come on now everyone on discord went full a personal phase or period when that happened.,bruh everyone on discord went full villain era when that happened.
is anyone else frustrated by that that's very awkward or bad decision not going to lie,anyone else tilted by that big yikes move no cap
i'm just hanging out with friends at the mall today.,just vibing with the squad at the mall today.
"everyone how delightfully unable to relax, intense of you, congratulations on achieving that",dead ass oh how delightfully no chill congratulations on that
i genuinely cannot believe how quickly this became skill gap between players,genuinely cannot believe how diff this got very fast
"yes, because what we truly needed was more the cafeteria food is excellent",yes because what we really needed was moree cafeteria bussinn
i have to admit that was quite just kidding,ngl that was super jk
"i'm really tired after a long day, i just want to relax.","i'm so drained after today, just wanna chill and kick back."
i just bought a new hoodie and i love how cozy it feels.,"just copped a fresh hoodie and it's mad comfy, no cap!"
he performed a i don't care move at the last second,he pulled a idc clutch at the last second
"hey, i really like your new shoes!","yo, those kicks are fire, no cap!"
i'm going to grab some lunch with my friends later.,i'm chillin' with my crew for some grub later.
the internet blew up because that was straight extremely being the greatest.,the internet blew up because that was straight goated af.
i'm just going to hang out with friends this afternoon.,"i'm just popping off with my friends later, no cap."
that player simply executed a if you know you know play,bro that player simply hit a iykyk play
"wait, is that not considered greatest of all time? i promise",wait is that not goat istg
contact me when you are done experiencing sarcastically unimpressed,hmu when you're done being no way that's so cool ok
